{
  "schema_version": 1,
  "job_id": "job:icml:2026:scrape:001",
  "job_type": "scrape_existing",
  "venue_id": "icml",
  "year": 2026,
  "created_at": "2026-07-13T13:00:00Z",
  "requested_by": "action_router",
  "input_artifact_ids": ["evidence:icml:2026:pdf-ready"],
  "payload": {
    "completeness_level": "archival",
    "download_pdfs": true,
    "expected_count": 100
  }
}
